SET documentdb.next_collection_id TO 1983000;
SET documentdb.next_collection_index_id TO 1983000;
SET documentdb.maxUserLimit TO 10;
\set VERBOSITY TERSE
-- Enable role CRUD operations for testing
SET documentdb.enableRoleCrud TO ON;
-- Enable db admin requirement for testing
SET documentdb.enableRolesAdminDBCheck TO ON;
-- Create a custom role for testing rolesInfo with a custom role
SELECT documentdb_api.create_role('{"createRole":"test_custom_role", "roles":["readAnyDatabase"], "privileges":[], "$db":"admin"}');
            create_role            
-----------------------------------
 { "ok" : { "$numberInt" : "1" } }
(1 row)

-- ********* Test rolesInfo with int value *********
-- Test rolesInfo with 1
SELECT documentdb_api.roles_info('{"rolesInfo":1, "$db":"admin"}');
                                                                                                      roles_info
-----------------------------------------------------------------------------------------------------------------------------------------------------------------------------------------------------------------------
 { "roles" : [ { "_id" : "admin.test_custom_role", "role" : "test_custom_role", "db" : "admin", "isBuiltIn" : false, "roles" : [ { "role" : "readAnyDatabase", "db" : "admin" } ] } ], "ok" : { "$numberInt" : "1" } }
(1 row)

-- Test rolesInfo with int value other than 1, which is not allowed
SELECT documentdb_api.roles_info('{"rolesInfo":0, "$db":"admin"}');
ERROR:  'rolesInfo' must be 1, a string, a document, or an array.
-- Test rolesInfo with showPrivileges
SELECT documentdb_api.roles_info('{"rolesInfo":1, "showPrivileges":true, "$db":"admin"}');
                                                                                                                 roles_info                                                                                                                 
--------------------------------------------------------------------------------------------------------------------------------------------------------------------------------------------------------------------------------------------
 { "roles" : [ { "_id" : "admin.test_custom_role", "role" : "test_custom_role", "db" : "admin", "isBuiltIn" : false, "privileges" : [  ], "roles" : [ { "role" : "readAnyDatabase", "db" : "admin" } ] } ], "ok" : { "$numberInt" : "1" } }
(1 row)

-- Test rolesInfo with invalid showPrivileges type
SELECT documentdb_api.roles_info('{"rolesInfo":1, "showPrivileges":1, "$db":"admin"}');
ERROR:  'showPrivileges' must be a boolean value
-- Test rolesInfo with showBuiltInRoles
SELECT documentdb_api.roles_info('{"rolesInfo":1, "showBuiltInRoles":true, "$db":"admin"}');
                                                                                                      roles_info
-----------------------------------------------------------------------------------------------------------------------------------------------------------------------------------------------------------------------
 { "roles" : [ { "_id" : "admin.test_custom_role", "role" : "test_custom_role", "db" : "admin", "isBuiltIn" : false, "roles" : [ { "role" : "readAnyDatabase", "db" : "admin" } ] } ], "ok" : { "$numberInt" : "1" } }
(1 row)

-- Test internal RBAC roles are hidden from rolesInfo.
SELECT documentdb_api.roles_info('{"rolesInfo":["documentdb_rbac_api_access_role", "documentdb_rbac_baseline_read_role", "documentdb_rbac_baseline_write_role", "documentdb_rbac_readwrite_anydb_role"], "$db":"admin"}');
                    roles_info
---------------------------------------------------
 { "roles" : [  ], "ok" : { "$numberInt" : "1" } }
(1 row)

-- Test rolesInfo with showBuiltInRoles and showPrivileges
SELECT documentdb_api.roles_info('{"rolesInfo":1, "showBuiltInRoles":true, "showPrivileges":true, "$db":"admin"}');
                                                                                                                 roles_info
--------------------------------------------------------------------------------------------------------------------------------------------------------------------------------------------------------------------------------------------
 { "roles" : [ { "_id" : "admin.test_custom_role", "role" : "test_custom_role", "db" : "admin", "isBuiltIn" : false, "privileges" : [  ], "roles" : [ { "role" : "readAnyDatabase", "db" : "admin" } ] } ], "ok" : { "$numberInt" : "1" } }
(1 row)

-- Test rolesInfo with invalid showBuiltInRoles type
SELECT documentdb_api.roles_info('{"rolesInfo":1, "showBuiltInRoles":1, "$db":"admin"}');
ERROR:  'showBuiltInRoles' must be a boolean value
-- Test rolesInfo with unsupported field at root level
SELECT documentdb_api.roles_info('{"rolesInfo":1, "unsupportedField":"value", "$db":"admin"}');
ERROR:  Unsupported field specified: 'unsupportedField'.
-- Test rolesInfo with ignorable field at root level
SELECT documentdb_api.roles_info('{"rolesInfo":1, "lsid":"value", "$db":"admin"}');
                                                                                                      roles_info                                                                                                       
-----------------------------------------------------------------------------------------------------------------------------------------------------------------------------------------------------------------------
 { "roles" : [ { "_id" : "admin.test_custom_role", "role" : "test_custom_role", "db" : "admin", "isBuiltIn" : false, "roles" : [ { "role" : "readAnyDatabase", "db" : "admin" } ] } ], "ok" : { "$numberInt" : "1" } }
(1 row)

-- Test rolesInfo with missing mandatory rolesInfo field
SELECT documentdb_api.roles_info('{"$db":"admin"}');
ERROR:  'rolesInfo' is a required field.
-- Test rolesInfo with null value
SELECT documentdb_api.roles_info('{"rolesInfo":null, "$db":"admin"}');
ERROR:  'rolesInfo' must be 1, a string, a document, or an array.
-- ********* Test rolesInfo with string value *********
-- Test rolesInfo with string value of built-in role
-- which also doesn't require showBuiltInRoles since it's only an addon flag for rolesInfo:1
SELECT documentdb_api.roles_info('{"rolesInfo":"clusterAdmin", "showPrivileges":true, "$db":"admin"}');
                    roles_info
---------------------------------------------------
 { "roles" : [  ], "ok" : { "$numberInt" : "1" } }
(1 row)

SELECT documentdb_api.roles_info('{"rolesInfo":"readWriteAnyDatabase", "showPrivileges":true, "$db":"admin"}');
                    roles_info
---------------------------------------------------
 { "roles" : [  ], "ok" : { "$numberInt" : "1" } }
(1 row)

-- Test rolesInfo with string value of custom role
SELECT documentdb_api.roles_info('{"rolesInfo":"test_custom_role", "showPrivileges":true, "$db":"admin"}');
                                                                                                                 roles_info                                                                                                                 
--------------------------------------------------------------------------------------------------------------------------------------------------------------------------------------------------------------------------------------------
 { "roles" : [ { "_id" : "admin.test_custom_role", "role" : "test_custom_role", "db" : "admin", "isBuiltIn" : false, "privileges" : [  ], "roles" : [ { "role" : "readAnyDatabase", "db" : "admin" } ] } ], "ok" : { "$numberInt" : "1" } }
(1 row)

-- Test rolesInfo with string value of not-exist role
SELECT documentdb_api.roles_info('{"rolesInfo":"not_exist_role", "$db":"admin"}');
                    roles_info                     
---------------------------------------------------
 { "roles" : [  ], "ok" : { "$numberInt" : "1" } }
(1 row)

-- Test rolesInfo with empty string value, which is the same as specifying a not-exist role
SELECT documentdb_api.roles_info('{"rolesInfo":"", "$db":"admin"}');
                    roles_info                     
---------------------------------------------------
 { "roles" : [  ], "ok" : { "$numberInt" : "1" } }
(1 row)

-- Test rolesInfo with a Postgres role with oid < FirstNormalObjectId, which is not allowed
SELECT documentdb_api.roles_info('{"rolesInfo":"pg_signal_backend", "$db":"admin"}');
                    roles_info                     
---------------------------------------------------
 { "roles" : [  ], "ok" : { "$numberInt" : "1" } }
(1 row)

-- Test a user role with oid >= FirstNormalObjectId. Create a user then try to fetch it
SELECT documentdb_api.create_user('{"createUser":"test_user", "pwd":"test_password", "roles":[{"role":"readAnyDatabase","db":"admin"}], "$db":"admin"}');
            create_user            
-----------------------------------
 { "ok" : { "$numberInt" : "1" } }
(1 row)

SELECT documentdb_api.roles_info('{"rolesInfo":"test_user", "$db":"admin"}');
                    roles_info                     
---------------------------------------------------
 { "roles" : [  ], "ok" : { "$numberInt" : "1" } }
(1 row)

-- A database-only group role is not a catalog-backed custom role.
CREATE ROLE test_sql_only_role;
SELECT documentdb_api.roles_info('{"rolesInfo":"test_sql_only_role", "$db":"admin"}');
                    roles_info
---------------------------------------------------
 { "roles" : [  ], "ok" : { "$numberInt" : "1" } }
(1 row)

SELECT documentdb_core.bson_to_json_string(
	documentdb_api.roles_info('{"rolesInfo":1, "$db":"admin"}'))::text LIKE '%test_sql_only_role%'
	AS lists_sql_only_role;
 lists_sql_only_role
---------------------
 f
(1 row)

DROP ROLE test_sql_only_role;
-- ********* Test rolesInfo with role document *********
-- Test rolesInfo with basic role document
SELECT documentdb_api.roles_info('{"rolesInfo": {"role":"readAnyDatabase", "db":"admin"}, "$db":"admin"}');
                    roles_info
---------------------------------------------------
 { "roles" : [  ], "ok" : { "$numberInt" : "1" } }
(1 row)

-- Test rolesInfo with bson document with empty role or db
SELECT documentdb_api.roles_info('{"rolesInfo": {"role":"", "db":""}, "$db":"admin"}');
ERROR:  Unsupported value specified for db. Only 'admin' is allowed.
-- Test rolesInfo with bson document with miss db which is not allowed
SELECT documentdb_api.roles_info('{"rolesInfo": {"role":"readAnyDatabase"}, "$db":"admin"}');
ERROR:  'role' and 'db' are required fields.
-- Test rolesInfo with bson document with miss role which is not allowed
SELECT documentdb_api.roles_info('{"rolesInfo": {"db":"admin"}, "$db":"admin"}');
ERROR:  'role' and 'db' are required fields.
-- Test rolesInfo with bson document of invalid role field type
SELECT documentdb_api.roles_info('{"rolesInfo":{"role":1, "db":"admin"}, "$db":"admin"}');
ERROR:  'role' field must be a string.
-- Test rolesInfo with bson document of invalid role field type
SELECT documentdb_api.roles_info('{"rolesInfo":{"role":"readAnyDatabase", "db":1}, "$db":"admin"}');
ERROR:  'db' field must be a string.
-- Test rolesInfo with bson document with unknown field, which is not allowed
SELECT documentdb_api.roles_info('{"rolesInfo":{"role":"readAnyDatabase", "db":"admin", "unknownField":"value"}, "$db":"admin"}');
ERROR:  Unknown property 'unknownField' in role document.
-- Test rolesInfo with non-admin database, should fail
SELECT documentdb_api.roles_info('{"rolesInfo":{"role":"readAnyDatabase", "db":"admin"}, "$db":"nonAdminDatabase"}');
ERROR:  RolesInfo must be called from 'admin' database.
-- Test rolesInfo with no database, should fail
SELECT documentdb_api.roles_info('{"rolesInfo":{"role":"readAnyDatabase", "db":"admin"}}');
ERROR:  The required $db property is missing.
-- ********* Test rolesInfo with array *********
-- Test rolesInfo with empty array
SELECT documentdb_api.roles_info('{"rolesInfo":[], "$db":"admin"}');
                    roles_info                     
---------------------------------------------------
 { "roles" : [  ], "ok" : { "$numberInt" : "1" } }
(1 row)

-- Test rolesInfo with array of role names, including empty string
SELECT documentdb_api.roles_info('{"rolesInfo":["readAnyDatabase", "test_custom_role", "not_exist_role", ""], "$db":"admin"}');
                                                                                                      roles_info
-----------------------------------------------------------------------------------------------------------------------------------------------------------------------------------------------------------------------
 { "roles" : [ { "_id" : "admin.test_custom_role", "role" : "test_custom_role", "db" : "admin", "isBuiltIn" : false, "roles" : [ { "role" : "readAnyDatabase", "db" : "admin" } ] } ], "ok" : { "$numberInt" : "1" } }
(1 row)

-- Test rolesInfo with array of mixed bson document and string
SELECT documentdb_api.roles_info('{"rolesInfo":[{"role":"readAnyDatabase", "db":"admin"}, "test_custom_role"], "$db":"admin"}');
                                                                                                      roles_info
-----------------------------------------------------------------------------------------------------------------------------------------------------------------------------------------------------------------------
 { "roles" : [ { "_id" : "admin.test_custom_role", "role" : "test_custom_role", "db" : "admin", "isBuiltIn" : false, "roles" : [ { "role" : "readAnyDatabase", "db" : "admin" } ] } ], "ok" : { "$numberInt" : "1" } }
(1 row)

-- Test rolesInfo for multiple built-in roles
SELECT documentdb_api.roles_info('{"rolesInfo":["readAnyDatabase", "clusterAdmin"], "showBuiltInRoles":true, "$db":"admin"}');
                    roles_info
---------------------------------------------------
 { "roles" : [  ], "ok" : { "$numberInt" : "1" } }
(1 row)

-- Test rolesInfo when feature is disabled
SET documentdb.enableRoleCrud TO OFF;
SELECT documentdb_api.roles_info('{"rolesInfo":1, "$db":"admin"}');
ERROR:  RolesInfo command is not supported.
SET documentdb.enableRoleCrud TO ON;
-- Test rolesInfo with non-admin database when admin DB check is disabled, should succeed
SET documentdb.enableRolesAdminDBCheck TO OFF;
SELECT documentdb_api.roles_info('{"rolesInfo":1, "$db":"nonAdminDatabase"}');
                                                                                                      roles_info                                                                                                       
-----------------------------------------------------------------------------------------------------------------------------------------------------------------------------------------------------------------------
 { "roles" : [ { "_id" : "admin.test_custom_role", "role" : "test_custom_role", "db" : "admin", "isBuiltIn" : false, "roles" : [ { "role" : "readAnyDatabase", "db" : "admin" } ] } ], "ok" : { "$numberInt" : "1" } }
(1 row)

-- Test rolesInfo with no database when admin DB check is disabled
SELECT documentdb_api.roles_info('{"rolesInfo":1}');
                                                                                                      roles_info                                                                                                       
-----------------------------------------------------------------------------------------------------------------------------------------------------------------------------------------------------------------------
 { "roles" : [ { "_id" : "admin.test_custom_role", "role" : "test_custom_role", "db" : "admin", "isBuiltIn" : false, "roles" : [ { "role" : "readAnyDatabase", "db" : "admin" } ] } ], "ok" : { "$numberInt" : "1" } }
(1 row)

SET documentdb.enableRolesAdminDBCheck TO ON;
-- ********* Test rolesInfo reports inherited roles when the admin role has LOGIN *********
-- readWriteAnyDatabase and clusterAdmin are collapsed into a single grant of the
-- admin role. The admin role carrying LOGIN must not cause the roles it stands
-- for to be dropped from the response.
SELECT documentdb_api.create_role('{"createRole":"test_multi_inherit_role", "roles":["readAnyDatabase", "readWriteAnyDatabase", "clusterAdmin"], "privileges":[], "$db":"admin"}');
            create_role            
-----------------------------------
 { "ok" : { "$numberInt" : "1" } }
(1 row)

SELECT documentdb_api.roles_info('{"rolesInfo":"test_multi_inherit_role", "$db":"admin"}');
                                                                                                                                                              roles_info                                                                                                                                                               
---------------------------------------------------------------------------------------------------------------------------------------------------------------------------------------------------------------------------------------------------------------------------------------------------------------------------------------
 { "roles" : [ { "_id" : "admin.test_multi_inherit_role", "role" : "test_multi_inherit_role", "db" : "admin", "isBuiltIn" : false, "roles" : [ { "role" : "clusterAdmin", "db" : "admin" }, { "role" : "readAnyDatabase", "db" : "admin" }, { "role" : "readWriteAnyDatabase", "db" : "admin" } ] } ], "ok" : { "$numberInt" : "1" } }
(1 row)

ALTER ROLE documentdb_admin_role WITH LOGIN;
SELECT documentdb_api.roles_info('{"rolesInfo":"test_multi_inherit_role", "$db":"admin"}');
                                                                                                                                                              roles_info                                                                                                                                                               
---------------------------------------------------------------------------------------------------------------------------------------------------------------------------------------------------------------------------------------------------------------------------------------------------------------------------------------
 { "roles" : [ { "_id" : "admin.test_multi_inherit_role", "role" : "test_multi_inherit_role", "db" : "admin", "isBuiltIn" : false, "roles" : [ { "role" : "clusterAdmin", "db" : "admin" }, { "role" : "readAnyDatabase", "db" : "admin" }, { "role" : "readWriteAnyDatabase", "db" : "admin" } ] } ], "ok" : { "$numberInt" : "1" } }
(1 row)

ALTER ROLE documentdb_admin_role WITH NOLOGIN;
DROP ROLE IF EXISTS "test_multi_inherit_role";
DELETE FROM documentdb_api_catalog.roles WHERE role_name = 'test_multi_inherit_role';
-- ********* Test rolesInfo ignores out-of-band grants *********
-- The stored catalog definition remains authoritative when database
-- memberships are changed outside role CRUD.
SELECT documentdb_api.create_role('{"createRole":"test_stray_parent_role", "roles":["readAnyDatabase"], "privileges":[], "$db":"admin"}');
            create_role            
-----------------------------------
 { "ok" : { "$numberInt" : "1" } }
(1 row)

CREATE ROLE test_stray_login_role LOGIN;
GRANT test_stray_login_role TO "test_stray_parent_role";
SELECT documentdb_api.roles_info('{"rolesInfo":"test_stray_parent_role", "$db":"admin"}');
                                                                                                            roles_info
-----------------------------------------------------------------------------------------------------------------------------------------------------------------------------------------------------------------------------------
 { "roles" : [ { "_id" : "admin.test_stray_parent_role", "role" : "test_stray_parent_role", "db" : "admin", "isBuiltIn" : false, "roles" : [ { "role" : "readAnyDatabase", "db" : "admin" } ] } ], "ok" : { "$numberInt" : "1" } }
(1 row)

SELECT documentdb_api.roles_info('{"rolesInfo":1, "$db":"admin"}') IS NOT NULL AS lists_all_roles;
 lists_all_roles
-----------------
 t
(1 row)

REVOKE test_stray_login_role FROM "test_stray_parent_role";
-- Removing the grant does not change the reported metadata.
SELECT documentdb_api.roles_info('{"rolesInfo":"test_stray_parent_role", "$db":"admin"}');
                                                                                                            roles_info                                                                                                             
-----------------------------------------------------------------------------------------------------------------------------------------------------------------------------------------------------------------------------------
 { "roles" : [ { "_id" : "admin.test_stray_parent_role", "role" : "test_stray_parent_role", "db" : "admin", "isBuiltIn" : false, "roles" : [ { "role" : "readAnyDatabase", "db" : "admin" } ] } ], "ok" : { "$numberInt" : "1" } }
(1 row)

-- Transitive out-of-band grants are also ignored.
SELECT documentdb_api.create_role('{"createRole":"test_stray_child_role", "roles":["readAnyDatabase"], "privileges":[], "$db":"admin"}');
            create_role            
-----------------------------------
 { "ok" : { "$numberInt" : "1" } }
(1 row)

GRANT test_stray_login_role TO "test_stray_parent_role";
GRANT "test_stray_parent_role" TO "test_stray_child_role";
SELECT documentdb_api.roles_info('{"rolesInfo":"test_stray_child_role", "$db":"admin"}');
                                                                                                           roles_info
---------------------------------------------------------------------------------------------------------------------------------------------------------------------------------------------------------------------------------
 { "roles" : [ { "_id" : "admin.test_stray_child_role", "role" : "test_stray_child_role", "db" : "admin", "isBuiltIn" : false, "roles" : [ { "role" : "readAnyDatabase", "db" : "admin" } ] } ], "ok" : { "$numberInt" : "1" } }
(1 row)

REVOKE "test_stray_parent_role" FROM "test_stray_child_role";
REVOKE test_stray_login_role FROM "test_stray_parent_role";
DROP ROLE IF EXISTS "test_stray_child_role";
DROP ROLE IF EXISTS test_stray_login_role;
DROP ROLE IF EXISTS "test_stray_parent_role";
DELETE FROM documentdb_api_catalog.roles WHERE role_name IN ('test_stray_parent_role', 'test_stray_child_role');
-- ********* Test rolesInfo custom-role visibility *********
SELECT documentdb_api.create_role('{"createRole":"test_hidden_role", "roles":["readAnyDatabase"], "privileges":[], "$db":"admin"}');
            create_role
-----------------------------------
 { "ok" : { "$numberInt" : "1" } }
(1 row)

CREATE ROLE test_roles_info_reader LOGIN;
GRANT documentdb_readonly_role TO test_roles_info_reader;
GRANT test_custom_role TO test_roles_info_reader;
SELECT documentdb_api.create_role('{"createRole":"test_transitive_role", "roles":["readAnyDatabase"], "privileges":[], "$db":"admin"}');
            create_role
-----------------------------------
 { "ok" : { "$numberInt" : "1" } }
(1 row)

GRANT test_transitive_role TO test_custom_role;
SET ROLE documentdb_root_role;
SELECT documentdb_api.roles_info('{"rolesInfo":"test_hidden_role", "$db":"admin"}');
                                                                                                      roles_info
-----------------------------------------------------------------------------------------------------------------------------------------------------------------------------------------------------------------------
 { "roles" : [ { "_id" : "admin.test_hidden_role", "role" : "test_hidden_role", "db" : "admin", "isBuiltIn" : false, "roles" : [ { "role" : "readAnyDatabase", "db" : "admin" } ] } ], "ok" : { "$numberInt" : "1" } }
(1 row)

RESET ROLE;
CREATE ROLE test_roles_info_admin LOGIN;
GRANT documentdb_admin_role TO test_roles_info_admin;
SET ROLE test_roles_info_admin;
-- Admin-role membership can list all catalog-backed custom roles.
SELECT pg_has_role(current_user, 'documentdb_root_role', 'MEMBER')
	AS is_root_role_member,
	pg_has_role(current_user, 'documentdb_admin_role', 'MEMBER')
	AS is_admin_role_member;
 is_root_role_member | is_admin_role_member
---------------------+----------------------
 f                   | t
(1 row)

SELECT documentdb_api.roles_info('{"rolesInfo":"test_hidden_role", "$db":"admin"}');
                                                                                                      roles_info
-----------------------------------------------------------------------------------------------------------------------------------------------------------------------------------------------------------------------
 { "roles" : [ { "_id" : "admin.test_hidden_role", "role" : "test_hidden_role", "db" : "admin", "isBuiltIn" : false, "roles" : [ { "role" : "readAnyDatabase", "db" : "admin" } ] } ], "ok" : { "$numberInt" : "1" } }
(1 row)

SELECT documentdb_core.bson_to_json_string(
	documentdb_api.roles_info('{"rolesInfo":1, "$db":"admin"}'))::text
		LIKE '%test_hidden_role%'
	AS admin_lists_all_custom_roles;
 admin_lists_all_custom_roles
------------------------------
 t
(1 row)

RESET ROLE;
SET ROLE test_roles_info_reader;
SELECT pg_has_role(current_user, 'documentdb_root_role', 'MEMBER')
	AS is_root_role_member,
	pg_has_role(current_user, 'test_custom_role', 'MEMBER')
	AS is_direct_role_member,
	pg_has_role(current_user, 'test_transitive_role', 'MEMBER')
	AS is_transitive_role_member,
	pg_has_role(current_user, 'test_hidden_role', 'MEMBER')
	AS is_hidden_role_member;
 is_root_role_member | is_direct_role_member | is_transitive_role_member | is_hidden_role_member
---------------------+-----------------------+---------------------------+-----------------------
 f                   | t                     | t                         | f
(1 row)

SELECT documentdb_api.roles_info('{"rolesInfo":["readAnyDatabase", "test_custom_role", "test_transitive_role"], "$db":"admin"}');
                                                                                                                                                                                             roles_info
-----------------------------------------------------------------------------------------------------------------------------------------------------------------------------------------------------------------------------------------------------------------------------------------------------------------------------------------------------------------------------------------------------
 { "roles" : [ { "_id" : "admin.test_custom_role", "role" : "test_custom_role", "db" : "admin", "isBuiltIn" : false, "roles" : [ { "role" : "readAnyDatabase", "db" : "admin" } ] }, { "_id" : "admin.test_transitive_role", "role" : "test_transitive_role", "db" : "admin", "isBuiltIn" : false, "roles" : [ { "role" : "readAnyDatabase", "db" : "admin" } ] } ], "ok" : { "$numberInt" : "1" } }
(1 row)

SELECT documentdb_api.roles_info('{"rolesInfo":"test_hidden_role", "$db":"admin"}');
                    roles_info
---------------------------------------------------
 { "roles" : [  ], "ok" : { "$numberInt" : "1" } }
(1 row)

SELECT documentdb_api.roles_info('{"rolesInfo":["test_custom_role", "test_hidden_role"], "$db":"admin"}');
                                                                                                      roles_info
-----------------------------------------------------------------------------------------------------------------------------------------------------------------------------------------------------------------------
 { "roles" : [ { "_id" : "admin.test_custom_role", "role" : "test_custom_role", "db" : "admin", "isBuiltIn" : false, "roles" : [ { "role" : "readAnyDatabase", "db" : "admin" } ] } ], "ok" : { "$numberInt" : "1" } }
(1 row)

SELECT documentdb_api.roles_info('{"rolesInfo":1, "$db":"admin"}');
ERROR:  not authorized on admin to execute command { rolesInfo: 1 }
RESET ROLE;
REVOKE test_transitive_role FROM test_custom_role;
REVOKE test_custom_role FROM test_roles_info_reader;
REVOKE documentdb_readonly_role FROM test_roles_info_reader;
DROP ROLE test_roles_info_reader;
REVOKE documentdb_admin_role FROM test_roles_info_admin;
DROP ROLE test_roles_info_admin;
SELECT documentdb_api.drop_role('{"dropRole":"test_transitive_role", "$db":"admin"}');
             drop_role
-----------------------------------
 { "ok" : { "$numberInt" : "1" } }
(1 row)

SELECT documentdb_api.drop_role('{"dropRole":"test_hidden_role", "$db":"admin"}');
             drop_role
-----------------------------------
 { "ok" : { "$numberInt" : "1" } }
(1 row)

-- Clean up test roles created for rolesInfo testing
DROP ROLE IF EXISTS "test_custom_role";
DELETE FROM documentdb_api_catalog.roles WHERE role_name IN ('test_custom_role');
-- Reset settings
RESET documentdb.enableRoleCrud;
RESET documentdb.enableRolesAdminDBCheck;
